{
  "$schema": "http://json-schema.org/draft-07/schema#",
  "title": "OPERATING_MODEL_SCORECARD",
  "description": "Session grader output — 4 dimensions, 15pt max",
  "type": "object",
  "required": [
    "schema_version",
    "session_id",
    "timestamp",
    "work_dir",
    "grader_version",
    "dimensions",
    "composite",
    "verdict"
  ],
  "properties": {
    "schema_version": { "type": "string" },
    "session_id": { "type": "string" },
    "timestamp": { "type": "string", "format": "date-time" },
    "work_dir": { "type": "string" },
    "grader_version": { "type": "string" },
    "dimensions": {
      "type": "object",
      "required": [
        "hypothesis_discipline",
        "gate_integrity",
        "measurement_completeness",
        "learning_extraction"
      ],
      "additionalProperties": false,
      "properties": {
        "hypothesis_discipline": { "$ref": "#/definitions/dimension" },
        "gate_integrity": { "$ref": "#/definitions/dimension" },
        "measurement_completeness": { "$ref": "#/definitions/dimension" },
        "learning_extraction": { "$ref": "#/definitions/dimension" }
      }
    },
    "composite": {
      "type": "object",
      "required": ["score", "max", "percentage"],
      "properties": {
        "score": { "type": "integer" },
        "max": { "type": "integer" },
        "percentage": { "type": "number" }
      }
    },
    "verdict": { "type": "string", "enum": ["PASS", "PARTIAL", "FAIL"] }
  },
  "definitions": {
    "dimension": {
      "type": "object",
      "required": ["score", "max", "evidence"],
      "properties": {
        "score": { "type": "integer" },
        "max": { "type": "integer" },
        "evidence": { "type": "array", "items": { "type": "string" } }
      }
    }
  }
}
