{
  "schema_version": "1.0.0",
  "session_id": "20260224T024716Z",
  "timestamp": "2026-02-24T02:52:51Z",
  "work_dir": "work/20260224T024716Z",
  "grader_version": "ea3b41f",
  "dimensions": {
    "hypothesis_discipline": {
      "score": 3,
      "max": 3,
      "evidence": [
        "1pt: WORK.md has Prediction filled in",
        "1pt: PASS/FAIL criteria explicit in WORK.md",
        "1pt: Hypothesis stated checkbox marked"
      ]
    },
    "gate_integrity": {
      "score": 3,
      "max": 4,
      "evidence": [
        "1pt: Gate 1 ran (WORK.md + pre-audit/ present)",
        "0pt: 3/5 recent commits have trailers",
        "1pt: No --no-verify detected in recent commits",
        "1pt: Gate 3 ran (post-audit/ present)"
      ]
    },
    "measurement_completeness": {
      "score": 3,
      "max": 4,
      "evidence": [
        "1pt: pre-audit/SCORECARD.json exists",
        "1pt: post-audit/SCORECARD.json exists",
        "1pt: DELTA.md exists",
        "0pt: OPERATING_MODEL_SCORECARD.json not yet produced (expected on first run)"
      ]
    },
    "learning_extraction": {
      "score": 3,
      "max": 3,
      "evidence": [
        "1pt: 4 new L-number entries since baseline",
        "1pt: New entries use pipe-delimited table format",
        "1pt: New entries have non-empty source column"
      ]
    }
  },
  "composite": {
    "score": 12,
    "max": 15,
    "percentage": 80.0
  },
  "verdict": "PASS"
}
