{
  "schema_version": "1.0.0",
  "session_id": "20260522T233748Z",
  "timestamp": "2026-05-22T23:42:57Z",
  "work_dir": "work/20260522T233748Z",
  "grader_version": "c50cdb7",
  "dimensions": {
    "hypothesis_discipline": {
      "score": 3,
      "max": 3,
      "evidence": [
        "1pt: WORK.md has Prediction filled in",
        "1pt: PASS/FAIL criteria explicit in WORK.md",
        "1pt: Hypothesis stated checkbox marked"
      ]
    },
    "gate_integrity": {
      "score": 3,
      "max": 4,
      "evidence": [
        "1pt: Gate 1 ran (WORK.md + pre-audit/ present)",
        "0pt: 0/0 session-scoped (0 commits since c50cdb7) commits have trailers",
        "1pt: No --no-verify detected in session-scoped (0 commits since c50cdb7)",
        "1pt: Gate 3 ran (post-audit/ present)"
      ]
    },
    "measurement_completeness": {
      "score": 3,
      "max": 4,
      "evidence": [
        "1pt: pre-audit/SCORECARD.json exists",
        "1pt: post-audit/SCORECARD.json exists",
        "1pt: DELTA.md exists",
        "0pt: OPERATING_MODEL_SCORECARD.json not yet produced (expected on first run)"
      ]
    },
    "learning_extraction": {
      "score": 0,
      "max": 3,
      "evidence": [
        "0pt: No new L-number entries (baseline=17, current=17)",
        "0pt: No new entries to check format",
        "0pt: No new entries to check source"
      ]
    }
  },
  "composite": {
    "score": 9,
    "max": 15,
    "percentage": 60.0
  },
  "verdict": "PARTIAL"
}
