{
  "schema_version": "1.0.0",
  "session_id": "golden-regrade",
  "timestamp": "2026-02-28T16:10:18Z",
  "work_dir": "tests/fixtures/golden-work-dir",
  "grader_version": "8c3f76e",
  "dimensions": {
    "hypothesis_discipline": {
      "score": 3,
      "max": 3,
      "evidence": [
        "1pt: WORK.md has Prediction filled in",
        "1pt: PASS/FAIL criteria explicit in WORK.md",
        "1pt: Hypothesis stated checkbox marked"
      ]
    },
    "gate_integrity": {
      "score": 3,
      "max": 4,
      "evidence": [
        "1pt: Gate 1 ran (WORK.md + pre-audit/ present)",
        "1pt: All 5 recent commits (fallback, no .start_sha) commits have Spec-ID/Spec-Exempt trailer",
        "0pt: 1 commits with No-Verify-Reason in recent commits (fallback, no .start_sha)",
        "1pt: Gate 3 ran (post-audit/ present)"
      ]
    },
    "measurement_completeness": {
      "score": 4,
      "max": 4,
      "evidence": [
        "1pt: pre-audit/SCORECARD.json exists",
        "1pt: post-audit/SCORECARD.json exists",
        "1pt: DELTA.md exists",
        "1pt: OPERATING_MODEL_SCORECARD.json exists"
      ]
    },
    "learning_extraction": {
      "score": 3,
      "max": 3,
      "evidence": [
        "1pt: 4 new L-number entries since baseline",
        "1pt: New entries use pipe-delimited table format",
        "1pt: New entries have non-empty source column"
      ]
    }
  },
  "composite": {
    "score": 13,
    "max": 15,
    "percentage": 86.7
  },
  "verdict": "PASS"
}
